{
  "ontology_type": "relationship",
  "version": "0.1.1",
  "last_updated": "2025-11-22T06:24:15.423992Z",
  "elements": [
    {
      "type": "DOCUMENTS",
      "source_partitions": [
        "example_partition"
      ],
      "all_example_files": [
        "data/rosa-kcs/kcs_solutions/5609901-red-hat-openshift-service-on-aws-(rosa)-pre-ga-support.md",
        "data/rosa-kcs/kcs_solutions/5609901-red-hat-openshift-service-on-aws-(rosa)-pre-ga-support.md"
      ],
      "description": "KnowledgeBaseArticle entities document various AWS services and ROSA configurations. This relationship captures how documentation relates to technical concepts."
    },
    {
      "type": "REQUIRES",
      "source_partitions": [
        "example_partition"
      ],
      "all_example_files": [
        "data/rosa-kcs/kcs_solutions/5795441-cloud-credentials-insufficient-to-satisfy-credentialsrequest-on-aws-rhocp-4.md",
        "data/rosa-kcs/kcs_solutions/5795441-cloud-credentials-insufficient-to-satisfy-credentialsrequest-on-aws-rhocp-4.md"
      ],
      "description": "ROSA clusters require specific AWS credentials and permissions. This relationship captures dependency requirements between system components."
    }
  ]
}