{
  "ontology_type": "entity",
  "version": "0.1.1",
  "last_updated": "2025-11-22T06:24:15.423758Z",
  "elements": [
    {
      "type": "AWSService",
      "source_partitions": [
        "example_partition"
      ],
      "all_example_files": [
        "data/rosa-kcs/kcs_solutions/5795441-cloud-credentials-insufficient-to-satisfy-credentialsrequest-on-aws-rhocp-4.md"
      ],
      "description": "References to AWS services like S3, IAM, EC2 that integrate with ROSA clusters. These are cloud infrastructure components that ROSA depends on."
    },
    {
      "type": "KnowledgeBaseArticle",
      "source_partitions": [
        "example_partition"
      ],
      "all_example_files": [
        "data/rosa-kcs/kcs_solutions/5609901-red-hat-openshift-service-on-aws-(rosa)-pre-ga-support.md"
      ],
      "description": "KCS solution articles that document troubleshooting steps, configurations, and best practices for ROSA."
    }
  ]
}